{
  "standardVersion": 1,
  "schemaUrl": "https://raw.githubusercontent.com/spdx/spdx-spec/development/v2.3.1/schemas/spdx-schema.json",
  "created": "2023-05-15T12:34:56Z",
  "modified": "2023-05-15T12:34:56Z",
  "notarizations": [
    {
      "notaryId": "not1",
      "notaryMeta": {}
    }
  ],
  "links": [
    {
      "assetUri": "string",
      "type": "asset",
      "comment": "example2",
      "id": "Link1"
    }
  ],
  "signatures": [
    {
      "hashType": "SHA256",
      "signType": "type1",
      "signMeta": {
        "authority": "user1",
        "keyId": "12345",
        "sign": "asdfbiuvagebvbayerfasdfbsjasdfdliufgalsi"
      }
    }
  ],
  "body": {},
  "id": "id1"
}
